{
  "timestamp_salvamento": "2025-10-30T14:09:06.586865",
  "arquivo_xml_nome": "29250507704914000344550010000745461745461769 - Copy.xml",
  "cabecalho_df": [
    {
      "N√∫mero NF": "ENC:Z0FBQUFBQnBBNm1neWl4VzJGTkgzZmRwZnlwT18xSGJWcHhYbm1uUGpTSmFXMlVzVWdmRnk2cld0a0wxNktvWi0zczF1eEdJZC0wQV9QbWs0djRadnczbUFQX3lvWFNhLXc9PQ==",
      "S√©rie": "1",
      "Data Emiss√£o": "2025-05-21T00:00:00-03:00",
      "Data Sa√≠da/Entrada": "2025-05-21T00:00:00-03:00",
      "Natureza Opera√ß√£o": "VENDA",
      "Tipo NF": "1",
      "Modelo": "55",
      "UF": "29",
      "Finalidade": "1",
      "Emitente CNPJ": "ENC:Z0FBQUFBQnBBNm1nUEdCaXNjRlAwY2lOUjNjWV9NM0tMUXlucHRXR21sdVY2dUxBNmJiaEtPUEtjVnFRMkJZZUdvOGxYc1ZrV2dkR1F4eU5WN1lmeGhLVzlJMms4YVBtSHc9PQ==",
      "Emitente Nome": "ENC:Z0FBQUFBQnBBNm1nT3lBcGpYUmRhQ0dUdFIzd0lxOHhyaUgxTzEyb3I4RGhCNFdmRHVacDdJTFpxRnBBZWwyVFE3QkNQQUhxQmM5UnIyTVdWR1BEOGJVMVlrbTJxbjFLSFBjWmdNSDNVTGRMTVF5VE1aSjlLeU09",
      "Emitente Fantasia": "ENC:Z0FBQUFBQnBBNm1nUnl6SGtoSHg4VEY5Z3ZGRkl2NlNzUWpVTWdvTVNYOHhPSDRrTTFIRVVnU0p2ZXlDaEdlWmV4V0ZXdXQxRzF3QnJ5NzhFdGxUcklzX3NDZkg2YlhJUmc9PQ==",
      "Emitente IE": "ENC:Z0FBQUFBQnBBNm1nS0hnN1BBdlF3QWFrUmZ1SVVRalNkV21OM1JHdDV3a2VuYzJhNkl3RVJmODhRenVlNkh2ajNTU0E5VXdaWkVGTlJHVTFsbERxR0E1alViNV9SRWU5SlE9PQ==",
      "Emitente UF": "BA",
      "Emitente Munic√≠pio": "ENC:Z0FBQUFBQnBBNm1nZHVMc0xXLXJBcExqdFEwN0NHT0ZkdDZ3QnJvRzdZYmYzaDJFU2FyS3ZIX3pSMDRITHNYWUF3MkZHV1FRelFtZU10bjd6OTRHWkFCYnB3SDN6QklNeXc9PQ==",
      "Emitente CEP": "ENC:Z0FBQUFBQnBBNm1nT1hiY25fMGdwekhkUThfLWVJTkw1YVNJdGFCbVlzNnFvZlV0WFQ3YlZGSkZaRVRNZ3FHaTFzN0E0VjJxX2daLUNyVzVoZWphRkJINVpRbkQ4THZveGc9PQ==",
      "Destinat√°rio CNPJ": "ENC:Z0FBQUFBQnBBNm1nZExnbElPYU1TeVlxMEl0c2UzdTNxb1EyenpuSjRKclRRbXYzajRwcjJVS1ZXQ2g1dXdycHVWdW4tZmJmV09BeldnY3dSN19hdWxJdzlCdXl2SkRQbFE9PQ==",
      "Destinat√°rio Nome": "ENC:Z0FBQUFBQnBBNm1nejZKY05ZdnhmVGk3bmtMRERnX0dKZTNHWTJ2SHlwQ0k0bF9YX2JCNmdVTWppWkRnY1BlWUxJOFVicHR5bUExVEVWVVJTMENnaWtSdUt0NVByR2pxTzhvUWVPRHE0c2JfN181SjBfWHBxS2xwdy01Q1JDV19HRUU1WXhZQ203Y1A=",
      "Destinat√°rio IE": "ENC:Z0FBQUFBQnBBNm1nUEtRZkhxTVZveUZqNFdVWkRfZlhRLTdSakplcU44WWszR3pTNnNQdlRQcWZsV2w0OU9fRkJackdHa0sxZG9qYVJHaDRGTE12eDhRRHZ6bU9zVmRTY2c9PQ==",
      "Destinat√°rio UF": "SP",
      "Destinat√°rio Munic√≠pio": "ENC:Z0FBQUFBQnBBNm1nZ3pfR09rZEZNaUI2Y1VBUG9tU0tBTU52VU9MbDhBV0ZRSlNqM2JSeFhWRXhWZzZSRFBxQXdNMW5XdmpFRTFMTE0tWC1wS2pVYWhNQVRWZHQ2VzM4Q2c9PQ==",
      "Destinat√°rio CEP": "ENC:Z0FBQUFBQnBBNm1nX0JQazluOW9yTzZZWlU5MGJnMDk0U0lSUXhMY0pwSUhOUVhDdGJPUUpLdnNqQUlDZHVXOUQ5QjNTTU5TZTZlVXJ0UjBDaUs5R3pLTTNxaDM1ODFTN1E9PQ==",
      "Modalidade Frete": "0",
      "Transportadora Nome": "ENC:Z0FBQUFBQnBBNm1nWVN4dnM1a05zdU03dnAxQmhzQ095YXRMc05sb2VYUU1LODBsTEJnMnVsTGM3MHBnX2QtR3dRN0NCUmFpSjVZMzRtNldpeTJ4a0UteU05R3FGS0ZQWGI4RHJHc2hPYjFrWkM5NTFQdWFSeXZZUGhhdEJFc0pSREhONTBfZzQxNWQ=",
      "Transportadora CNPJ": "ENC:Z0FBQUFBQnBBNm1neVU4NW9ybjRJZTVQSUtERGthZUYtSnNPenBCMlc3ZEg3VGVJUy0za0pCOTJONngwYjl2bm9JMHl1SDkzYmlmOTV2ejZlcXdRMVhoNzktNXVwRzFraVE9PQ==",
      "Transportadora UF": "BA",
      "Qtde Volumes": "23",
      "Peso L√≠quido": "27.630",
      "Peso Bruto": "30.440",
      "N√∫mero Fatura": "74546",
      "Valor Original": "1747.50",
      "Valor L√≠quido": "1747.50",
      "N√∫mero Duplicata": "001",
      "Data Vencimento": "2025-05-21",
      "Valor Duplicata": "1747.50",
      "Base ICMS": "1733.79",
      "Valor ICMS": "208.07",
      "Valor Produtos": "1733.79",
      "Valor NF": "1747.50",
      "Valor Frete": "0",
      "Valor IPI": "13.71",
      "Valor COFINS": "115.95",
      "Valor PIS": "25.16",
      "Emitente CNPJ_hash": "8fa982fe0e1c2ef6",
      "Destinat√°rio CNPJ_hash": "fe97dc6bcbb616c0",
      "Transportadora CNPJ_hash": "73d7b890ca558b17",
      "Emitente IE_hash": "93b4946c4dbd5a7c",
      "Destinat√°rio IE_hash": "419f335059764a05",
      "Emitente Nome_hash": "b37aadaa7e465ff2",
      "Destinat√°rio Nome_hash": "b67c4a0fe01d34af",
      "Transportadora Nome_hash": "665d147f3f1ccdad",
      "Emitente Fantasia_hash": "92b6f3ac28b7d182",
      "N√∫mero NF_hash": "34ea92079d24d75d",
      "Emitente CEP_hash": "ad8c4faf8856044b",
      "Destinat√°rio CEP_hash": "a02c1f55ddbee31c",
      "Emitente Munic√≠pio_hash": "602cac6ebcc5a39c",
      "Destinat√°rio Munic√≠pio_hash": "43f0cc3d34400f29",
      "_encrypted_timestamp": "2025-10-30T14:08:32.058886",
      "_encryption_version": "2.0_selective",
      "_public_fields_count": 13,
      "_encrypted_fields_count": 14
    }
  ],
  "produtos_df": [
    {
      "Item": "1",
      "C√≥digo": "2",
      "Descri√ß√£o": "ORBIVED SELANTE VERMELHO 50G",
      "NCM": "32141010",
      "CFOP": "6101",
      "Unidade": "BIS",
      "Quantidade": "156.0000",
      "Valor Unit√°rio": "4.6269",
      "Valor Total": "721.80",
      "ICMS": "86.62",
      "IPI": "9.38",
      "PIS": "10.48",
      "COFINS": "48.27",
      "_encrypted_timestamp": "2025-10-30T14:08:32.063883",
      "_encryption_version": "2.0_selective",
      "_public_fields_count": 7,
      "_encrypted_fields_count": 0
    },
    {
      "Item": "2",
      "C√≥digo": "336",
      "Descri√ß√£o": "ORBIVED SELANTE CINZA 50G",
      "NCM": "32141010",
      "CFOP": "6101",
      "Unidade": "BIS",
      "Quantidade": "24.0000",
      "Valor Unit√°rio": "4.6269",
      "Valor Total": "111.05",
      "ICMS": "1350012.33",
      "IPI": "1.44",
      "PIS": "1.61",
      "COFINS": "7.43",
      "_encrypted_timestamp": "2025-10-30T14:08:32.063883",
      "_encryption_version": "2.0_selective",
      "_public_fields_count": 7,
      "_encrypted_fields_count": 0
    },
    {
      "Item": "3",
      "C√≥digo": "337",
      "Descri√ß√£o": "ORBIVED SELANTE PARA MOTOR PRETO 50G",
      "NCM": "32141010",
      "CFOP": "6101",
      "Unidade": "BIS",
      "Quantidade": "48.0000",
      "Valor Unit√°rio": "4.6269",
      "Valor Total": "222.09",
      "ICMS": "26.65",
      "IPI": "2.89",
      "PIS": "3.22",
      "COFINS": "14.85",
      "_encrypted_timestamp": "2025-10-30T14:08:32.063883",
      "_encryption_version": "2.0_selective",
      "_public_fields_count": 7,
      "_encrypted_fields_count": 0
    },
    {
      "Item": "4",
      "C√≥digo": "1533",
      "Descri√ß√£o": "ORBI COLA JUNTAS 75G - CAIXA 36 UN COLMEIA",
      "NCM": "35069110",
      "CFOP": "6101",
      "Unidade": "BIS",
      "Quantidade": "72.0000",
      "Valor Unit√°rio": "4.268",
      "Valor Total": "307.30",
      "ICMS": "36.88",
      "IPI": "0",
      "PIS": "4.46",
      "COFINS": "20.55",
      "_encrypted_timestamp": "2025-10-30T14:08:32.063883",
      "_encryption_version": "2.0_selective",
      "_public_fields_count": 7,
      "_encrypted_fields_count": 0
    },
    {
      "Item": "5",
      "C√≥digo": "2880",
      "Descri√ß√£o": "ORBICOLA - ADES CONTATO - AMBAR 75 G - COLMEIA",
      "NCM": "35061090",
      "CFOP": "6101",
      "Unidade": "BIS",
      "Quantidade": "72.0000",
      "Valor Unit√°rio": "5.1604",
      "Valor Total": "371.55",
      "ICMS": "44.59",
      "IPI": "0",
      "PIS": "500.39",
      "COFINS": "24.85",
      "_encrypted_timestamp": "2025-10-30T14:08:32.063883",
      "_encryption_version": "2.0_selective",
      "_public_fields_count": 7,
      "_encrypted_fields_count": 0
    }
  ],
  "resultado_validador": {
    "status": "parcial",
    "produtos_analisados": 5,
    "oportunidades": [
      {
        "tipo": "Monofasico Autope√ßas",
        "produto": "32141010",
        "descricao": "Verificar enquadramento no regime monof√°sico para autope√ßas. Se aplic√°vel, PIS/COFINS podem ser recolhidos apenas na ind√∫stria/importador, resultando em al√≠quota zero para o revendedor.",
        "impacto": "Alto",
        "acao_recomendada": "Consultar a lista de autope√ßas sujeitas ao regime monof√°sico (Lei n¬∫ 10.485/02 e altera√ß√µes) e confirmar se o NCM 32141010 se enquadra."
      },
      {
        "tipo": "Monofasico Autope√ßas",
        "produto": "35069110",
        "descricao": "Verificar enquadramento no regime monof√°sico para autope√ßas. Se aplic√°vel, PIS/COFINS podem ser recolhidos apenas na ind√∫stria/importador, resultando em al√≠quota zero para o revendedor.",
        "impacto": "Alto",
        "acao_recomendada": "Consultar a lista de autope√ßas sujeitas ao regime monof√°sico (Lei n¬∫ 10.485/02 e altera√ß√µes) e confirmar se o NCM 35069110 se enquadra."
      },
      {
        "tipo": "Monofasico Autope√ßas",
        "produto": "35061090",
        "descricao": "Verificar enquadramento no regime monof√°sico para autope√ßas. Se aplic√°vel, PIS/COFINS podem ser recolhidos apenas na ind√∫stria/importador, resultando em al√≠quota zero para o revendedor.",
        "impacto": "Alto",
        "acao_recomendada": "Consultar a lista de autope√ßas sujeitas ao regime monof√°sico (Lei n¬∫ 10.485/02 e altera√ß√µes) e confirmar se o NCM 35061090 se enquadra."
      }
    ],
    "discrepancias": [
      {
        "tipo": "Al√≠quota Incorreta",
        "produto": "Todos",
        "problema": "N√£o foi informada a UF de destino, impossibilitando a verifica√ß√£o da al√≠quota interestadual de ICMS correta (4%, 7% ou 12%).",
        "gravidade": "Alta",
        "correcao": "Obter a UF de destino da NFe e verificar se a al√≠quota de ICMS aplicada est√° de acordo com as regras interestaduais (4% para Sul/Sudeste n√£o contribuinte, 7% para Norte/Nordeste/Centro-Oeste n√£o contribuinte, 12% para contribuintes)."
      }
    ],
    "resumo_executivo": "A an√°lise preliminar da NFe revela oportunidades de otimiza√ß√£o fiscal relacionadas ao regime monof√°sico de PIS/COFINS para autope√ßas. √â crucial verificar se os NCMs dos produtos (32141010, 35069110 e 35061090) se enquadram nesse regime. Al√©m disso, a aus√™ncia da UF de destino impede a valida√ß√£o da al√≠quota interestadual de ICMS, representando um risco de n√£o conformidade. Recomenda-se obter essa informa√ß√£o e verificar a al√≠quota aplicada.",
    "detalhes_tecnicos": "A an√°lise foi realizada com base nos dados fornecidos (NCM, CFOP, quantidade, valor unit√°rio e valor total) e no banco de regras fiscais. A verifica√ß√£o da al√≠quota de ICMS interestadual (regra 'aliquotas_interestaduais') n√£o p√¥de ser totalmente conclu√≠da devido √† falta da UF de destino. A an√°lise de PIS/COFINS considerou a possibilidade de enquadramento no regime monof√°sico (regra 'monofasico_aliquota_zero'). N√£o foi poss√≠vel verificar a aplica√ß√£o da Substitui√ß√£o Tribut√°ria (ICMS-ST) pois a UF de destino √© necess√°ria para determinar se h√° conv√™nio/protocolo entre os estados para os NCMs listados.",
    "banco_regras_carregado": true,
    "modelo_utilizado": "gemini",
    "resumo_dropdown": "## RELAT√ìRIO DE AN√ÅLISE FISCAL\n\n**Status:** parcial\n**Produtos analisados:** 5\n**Oportunidades:** 3\n**Discrep√¢ncias:** 1\n\n### RESUMO EXECUTIVO\n\nA an√°lise preliminar da NFe revela oportunidades de otimiza√ß√£o fiscal relacionadas ao regime monof√°sico de PIS/COFINS para autope√ßas. √â crucial verificar se os NCMs dos produtos (32141010, 35069110 e 35061090) se enquadram nesse regime. Al√©m disso, a aus√™ncia da UF de destino impede a valida√ß√£o da al√≠quota interestadual de ICMS, representando um risco de n√£o conformidade. Recomenda-se obter essa informa√ß√£o e verificar a al√≠quota aplicada.\n\n### OPORTUNIDADES IDENTIFICADAS\n\n**1. Monofasico Autope√ßas**\n   ‚Ä¢ **Produto:** 32141010\n   ‚Ä¢ **Descri√ß√£o:** Verificar enquadramento no regime monof√°sico para autope√ßas. Se aplic√°vel, PIS/COFINS podem ser recolhidos apenas na ind√∫stria/importador, resultando em al√≠quota zero para o revendedor.\n   ‚Ä¢ **Impacto:** Alto\n   ‚Ä¢ **A√ß√£o:** Consultar a lista de autope√ßas sujeitas ao regime monof√°sico (Lei n¬∫ 10.485/02 e altera√ß√µes) e confirmar se o NCM 32141010 se enquadra.\n\n**2. Monofasico Autope√ßas**\n   ‚Ä¢ **Produto:** 35069110\n   ‚Ä¢ **Descri√ß√£o:** Verificar enquadramento no regime monof√°sico para autope√ßas. Se aplic√°vel, PIS/COFINS podem ser recolhidos apenas na ind√∫stria/importador, resultando em al√≠quota zero para o revendedor.\n   ‚Ä¢ **Impacto:** Alto\n   ‚Ä¢ **A√ß√£o:** Consultar a lista de autope√ßas sujeitas ao regime monof√°sico (Lei n¬∫ 10.485/02 e altera√ß√µes) e confirmar se o NCM 35069110 se enquadra.\n\n**3. Monofasico Autope√ßas**\n   ‚Ä¢ **Produto:** 35061090\n   ‚Ä¢ **Descri√ß√£o:** Verificar enquadramento no regime monof√°sico para autope√ßas. Se aplic√°vel, PIS/COFINS podem ser recolhidos apenas na ind√∫stria/importador, resultando em al√≠quota zero para o revendedor.\n   ‚Ä¢ **Impacto:** Alto\n   ‚Ä¢ **A√ß√£o:** Consultar a lista de autope√ßas sujeitas ao regime monof√°sico (Lei n¬∫ 10.485/02 e altera√ß√µes) e confirmar se o NCM 35061090 se enquadra.\n\n### DISCREP√ÇNCIAS ENCONTRADAS\n\n**1. Al√≠quota Incorreta üî¥**\n   ‚Ä¢ **Produto:** Todos\n   ‚Ä¢ **Problema:** N√£o foi informada a UF de destino, impossibilitando a verifica√ß√£o da al√≠quota interestadual de ICMS correta (4%, 7% ou 12%).\n   ‚Ä¢ **Gravidade:** Alta\n   ‚Ä¢ **Corre√ß√£o:** Obter a UF de destino da NFe e verificar se a al√≠quota de ICMS aplicada est√° de acordo com as regras interestaduais (4% para Sul/Sudeste n√£o contribuinte, 7% para Norte/Nordeste/Centro-Oeste n√£o contribuinte, 12% para contribuintes).\n\n### DETALHES T√âCNICOS\n\nA an√°lise foi realizada com base nos dados fornecidos (NCM, CFOP, quantidade, valor unit√°rio e valor total) e no banco de regras fiscais. A verifica√ß√£o da al√≠quota de ICMS interestadual (regra 'aliquotas_interestaduais') n√£o p√¥de ser totalmente conclu√≠da devido √† falta da UF de destino. A an√°lise de PIS/COFINS considerou a possibilidade de enquadramento no regime monof√°sico (regra 'monofasico_aliquota_zero'). N√£o foi poss√≠vel verificar a aplica√ß√£o da Substitui√ß√£o Tribut√°ria (ICMS-ST) pois a UF de destino √© necess√°ria para determinar se h√° conv√™nio/protocolo entre os estados para os NCMs listados.\n\n"
  },
  "resultado_analista": {
    "status": "parcial",
    "regime_tributario": "LUCRO REAL",
    "discrepancias_analisadas": 1,
    "analises_detalhadas": [
      {
        "discrepancia_original": "N√£o foi informada a UF de destino, impossibilitando a verifica√ß√£o da al√≠quota interestadual de ICMS correta (4%, 7% ou 12%).",
        "analise_tecnica": "A legisla√ß√£o do ICMS estabelece al√≠quotas interestaduais diferenciadas com base na UF de origem e destino, bem como no tipo de contribuinte (contribuinte ou n√£o contribuinte do ICMS). A aus√™ncia da UF de destino impede a correta determina√ß√£o da al√≠quota aplic√°vel e o c√°lculo do ICMS devido. No caso de opera√ß√£o interestadual, √© necess√°rio verificar se h√° aplica√ß√£o do Diferencial de Al√≠quota (DIFAL) conforme Emenda Constitucional 87/2015, caso o destinat√°rio seja consumidor final.",
        "solucao_proposta": "Obter a informa√ß√£o da UF de destino do destinat√°rio. Com essa informa√ß√£o, verificar a al√≠quota interestadual de ICMS correta (4%, 7% ou 12%) com base na legisla√ß√£o vigente. Recalcular o ICMS devido e, se necess√°rio, retificar a NFe. Verificar a necessidade de recolhimento do DIFAL, caso o destinat√°rio seja consumidor final.",
        "base_legal": "Constitui√ß√£o Federal, Art. 155, ¬ß 2¬∫, VII; Lei Complementar n¬∫ 87/96 (Lei Kandir); Emenda Constitucional 87/2015; Conv√™nio ICMS 52/91.",
        "acao_imediata": "Entrar em contato com o destinat√°rio para confirmar a UF de destino. Documentar a comunica√ß√£o e a resposta obtida.",
        "acao_preventiva": "Implementar um processo de valida√ß√£o de dados cadastrais dos clientes, incluindo a UF, no momento do cadastro e antes da emiss√£o da NFe. Integrar a valida√ß√£o da UF de destino no sistema de emiss√£o de notas fiscais.",
        "grau_complexidade": "M√©dio",
        "requer_consultoria": false,
        "dados_necessarios": [
          "UF de destino do destinat√°rio"
        ]
      }
    ],
    "oportunidades_adicionais": [
      {
        "tipo": "Monofasico Autope√ßas",
        "descricao": "Verificar enquadramento no regime monof√°sico para autope√ßas para o NCM 32141010. Se aplic√°vel, PIS/COFINS podem ser recolhidos apenas na ind√∫stria/importador, resultando em al√≠quota zero para o revendedor.",
        "beneficio_estimado": "Redu√ß√£o da carga tribut√°ria de PIS/COFINS.",
        "aplicabilidade_lucro_real": "No Lucro Real, a correta identifica√ß√£o do regime monof√°sico permite a exclus√£o das receitas da base de c√°lculo do PIS/COFINS, reduzindo o imposto a pagar."
      },
      {
        "tipo": "Monofasico Autope√ßas",
        "descricao": "Verificar enquadramento no regime monof√°sico para autope√ßas para o NCM 35069110. Se aplic√°vel, PIS/COFINS podem ser recolhidos apenas na ind√∫stria/importador, resultando em al√≠quota zero para o revendedor.",
        "beneficio_estimado": "Redu√ß√£o da carga tribut√°ria de PIS/COFINS.",
        "aplicabilidade_lucro_real": "No Lucro Real, a correta identifica√ß√£o do regime monof√°sico permite a exclus√£o das receitas da base de c√°lculo do PIS/COFINS, reduzindo o imposto a pagar."
      },
      {
        "tipo": "Monofasico Autope√ßas",
        "descricao": "Verificar enquadramento no regime monof√°sico para autope√ßas para o NCM 35061090. Se aplic√°vel, PIS/COFINS podem ser recolhidos apenas na ind√∫stria/importador, resultando em al√≠quota zero para o revendedor.",
        "beneficio_estimado": "Redu√ß√£o da carga tribut√°ria de PIS/COFINS.",
        "aplicabilidade_lucro_real": "No Lucro Real, a correta identifica√ß√£o do regime monof√°sico permite a exclus√£o das receitas da base de c√°lculo do PIS/COFINS, reduzindo o imposto a pagar."
      }
    ],
    "plano_acao_consolidado": {
      "acoes_imediatas": [
        "Obter a UF de destino do destinat√°rio.",
        "Verificar o enquadramento dos NCMs 32141010, 35069110 e 35061090 no regime monof√°sico de PIS/COFINS para autope√ßas."
      ],
      "acoes_medio_prazo": [
        "Recalcular o ICMS devido com a al√≠quota correta.",
        "Retificar a NFe, se necess√°rio.",
        "Implementar valida√ß√£o de dados cadastrais dos clientes.",
        "Ajustar o sistema de emiss√£o de notas fiscais para validar a UF de destino."
      ],
      "consultoria_necessaria": [
        "Interpreta√ß√£o da legisla√ß√£o do regime monof√°sico para autope√ßas e enquadramento dos produtos espec√≠ficos."
      ],
      "documentos_necessarios": [
        "Cadastro completo do destinat√°rio.",
        "NFe original.",
        "Tabela de al√≠quotas de ICMS interestadual.",
        "Lista de autope√ßas sujeitas ao regime monof√°sico (Lei n¬∫ 10.485/02 e altera√ß√µes)."
      ],
      "riscos_identificados": [
        "Pagamento de ICMS em valor incorreto.",
        "Autua√ß√µes fiscais por emiss√£o de NFe com informa√ß√µes incorretas.",
        "Perda de oportunidades de redu√ß√£o da carga tribut√°ria de PIS/COFINS."
      ]
    },
    "limitacoes_analise": "A an√°lise foi limitada pela aus√™ncia da UF de destino do destinat√°rio, impossibilitando a valida√ß√£o da al√≠quota de ICMS interestadual.",
    "resumo_executivo": "A NFe apresenta uma discrep√¢ncia cr√≠tica devido √† falta da UF de destino, impactando o c√°lculo do ICMS. √â crucial obter essa informa√ß√£o para corrigir a NFe e evitar riscos fiscais. Adicionalmente, h√° oportunidades de otimiza√ß√£o tribut√°ria relacionadas ao regime monof√°sico de PIS/COFINS para autope√ßas. Recomenda-se verificar o enquadramento dos NCMs 32141010, 35069110 e 35061090 nesse regime para reduzir a carga tribut√°ria. Implementar valida√ß√µes de dados cadastrais e ajustar o sistema de emiss√£o de notas fiscais s√£o medidas preventivas importantes.",
    "detalhes_tecnicos": "A al√≠quota interestadual de ICMS varia entre 4%, 7% e 12%, dependendo da UF de origem e destino, e do tipo de contribuinte. A correta identifica√ß√£o da al√≠quota √© fundamental para o c√°lculo do ICMS devido e para evitar autua√ß√µes fiscais. O regime monof√°sico de PIS/COFINS para autope√ßas estabelece que o imposto √© recolhido apenas na primeira etapa da cadeia produtiva (ind√∫stria/importador), resultando em al√≠quota zero para o revendedor. A correta identifica√ß√£o dos produtos sujeitos a esse regime permite a exclus√£o das receitas da base de c√°lculo do PIS/COFINS, reduzindo o imposto a pagar.",
    "modelo_utilizado": "gemini",
    "timestamp_analise": "2025-10-30 14:08:55",
    "relatorio_final": "# RELAT√ìRIO ANAL√çTICO - TRATAMENTO DE DISCREP√ÇNCIAS\n\n** Status da An√°lise:** parcial\n**Regime Tribut√°rio:** LUCRO REAL\n**Discrep√¢ncias Analisadas:** 1\n**Timestamp:** 2025-10-30 14:08:55\n\n## RESUMO EXECUTIVO\n\nA NFe apresenta uma discrep√¢ncia cr√≠tica devido √† falta da UF de destino, impactando o c√°lculo do ICMS. √â crucial obter essa informa√ß√£o para corrigir a NFe e evitar riscos fiscais. Adicionalmente, h√° oportunidades de otimiza√ß√£o tribut√°ria relacionadas ao regime monof√°sico de PIS/COFINS para autope√ßas. Recomenda-se verificar o enquadramento dos NCMs 32141010, 35069110 e 35061090 nesse regime para reduzir a carga tribut√°ria. Implementar valida√ß√µes de dados cadastrais e ajustar o sistema de emiss√£o de notas fiscais s√£o medidas preventivas importantes.\n\n## üî¨ AN√ÅLISES DETALHADAS\n\n### 1. N√£o foi informada a UF de destino, impossibilitando a verifica√ß√£o da al√≠quota interestadual de ICMS correta (4%, 7% ou 12%). üü° \n\n**An√°lise T√©cnica:**\nA legisla√ß√£o do ICMS estabelece al√≠quotas interestaduais diferenciadas com base na UF de origem e destino, bem como no tipo de contribuinte (contribuinte ou n√£o contribuinte do ICMS). A aus√™ncia da UF de destino impede a correta determina√ß√£o da al√≠quota aplic√°vel e o c√°lculo do ICMS devido. No caso de opera√ß√£o interestadual, √© necess√°rio verificar se h√° aplica√ß√£o do Diferencial de Al√≠quota (DIFAL) conforme Emenda Constitucional 87/2015, caso o destinat√°rio seja consumidor final.\n\n**üí° Solu√ß√£o Proposta:**\nObter a informa√ß√£o da UF de destino do destinat√°rio. Com essa informa√ß√£o, verificar a al√≠quota interestadual de ICMS correta (4%, 7% ou 12%) com base na legisla√ß√£o vigente. Recalcular o ICMS devido e, se necess√°rio, retificar a NFe. Verificar a necessidade de recolhimento do DIFAL, caso o destinat√°rio seja consumidor final.\n\n**‚öñÔ∏è Base Legal:**\nConstitui√ß√£o Federal, Art. 155, ¬ß 2¬∫, VII; Lei Complementar n¬∫ 87/96 (Lei Kandir); Emenda Constitucional 87/2015; Conv√™nio ICMS 52/91.\n\n**A√ß√£o Imediata:**\nEntrar em contato com o destinat√°rio para confirmar a UF de destino. Documentar a comunica√ß√£o e a resposta obtida.\n\n**üõ°Ô∏è A√ß√£o Preventiva:**\nImplementar um processo de valida√ß√£o de dados cadastrais dos clientes, incluindo a UF, no momento do cadastro e antes da emiss√£o da NFe. Integrar a valida√ß√£o da UF de destino no sistema de emiss√£o de notas fiscais.\n\n**Dados Necess√°rios:**\n   ‚Ä¢ UF de destino do destinat√°rio\n\n## OPORTUNIDADES ADICIONAIS IDENTIFICADAS\n\n**1. Monofasico Autope√ßas**\n   ‚Ä¢ **Descri√ß√£o:** Verificar enquadramento no regime monof√°sico para autope√ßas para o NCM 32141010. Se aplic√°vel, PIS/COFINS podem ser recolhidos apenas na ind√∫stria/importador, resultando em al√≠quota zero para o revendedor.\n   ‚Ä¢ **Benef√≠cio:** Redu√ß√£o da carga tribut√°ria de PIS/COFINS.\n   ‚Ä¢ **Lucro Real:** No Lucro Real, a correta identifica√ß√£o do regime monof√°sico permite a exclus√£o das receitas da base de c√°lculo do PIS/COFINS, reduzindo o imposto a pagar.\n\n**2. Monofasico Autope√ßas**\n   ‚Ä¢ **Descri√ß√£o:** Verificar enquadramento no regime monof√°sico para autope√ßas para o NCM 35069110. Se aplic√°vel, PIS/COFINS podem ser recolhidos apenas na ind√∫stria/importador, resultando em al√≠quota zero para o revendedor.\n   ‚Ä¢ **Benef√≠cio:** Redu√ß√£o da carga tribut√°ria de PIS/COFINS.\n   ‚Ä¢ **Lucro Real:** No Lucro Real, a correta identifica√ß√£o do regime monof√°sico permite a exclus√£o das receitas da base de c√°lculo do PIS/COFINS, reduzindo o imposto a pagar.\n\n**3. Monofasico Autope√ßas**\n   ‚Ä¢ **Descri√ß√£o:** Verificar enquadramento no regime monof√°sico para autope√ßas para o NCM 35061090. Se aplic√°vel, PIS/COFINS podem ser recolhidos apenas na ind√∫stria/importador, resultando em al√≠quota zero para o revendedor.\n   ‚Ä¢ **Benef√≠cio:** Redu√ß√£o da carga tribut√°ria de PIS/COFINS.\n   ‚Ä¢ **Lucro Real:** No Lucro Real, a correta identifica√ß√£o do regime monof√°sico permite a exclus√£o das receitas da base de c√°lculo do PIS/COFINS, reduzindo o imposto a pagar.\n\n## PLANO DE A√á√ÉO CONSOLIDADO\n\n### A√á√ïES IMEDIATAS\n‚Ä¢ Obter a UF de destino do destinat√°rio.\n‚Ä¢ Verificar o enquadramento dos NCMs 32141010, 35069110 e 35061090 no regime monof√°sico de PIS/COFINS para autope√ßas.\n\n### üìÖ A√á√ïES M√âDIO PRAZO\n‚Ä¢ Recalcular o ICMS devido com a al√≠quota correta.\n‚Ä¢ Retificar a NFe, se necess√°rio.\n‚Ä¢ Implementar valida√ß√£o de dados cadastrais dos clientes.\n‚Ä¢ Ajustar o sistema de emiss√£o de notas fiscais para validar a UF de destino.\n\n### üë®‚ÄçCONSULTORIA NECESS√ÅRIA\n‚Ä¢ Interpreta√ß√£o da legisla√ß√£o do regime monof√°sico para autope√ßas e enquadramento dos produtos espec√≠ficos.\n\n### DOCUMENTOS A PROVIDENCIAR\n‚Ä¢ Cadastro completo do destinat√°rio.\n‚Ä¢ NFe original.\n‚Ä¢ Tabela de al√≠quotas de ICMS interestadual.\n‚Ä¢ Lista de autope√ßas sujeitas ao regime monof√°sico (Lei n¬∫ 10.485/02 e altera√ß√µes).\n\n### RISCOS SE N√ÉO CORRIGIR\n‚Ä¢ Pagamento de ICMS em valor incorreto.\n‚Ä¢ Autua√ß√µes fiscais por emiss√£o de NFe com informa√ß√µes incorretas.\n‚Ä¢ Perda de oportunidades de redu√ß√£o da carga tribut√°ria de PIS/COFINS.\n\n## LIMITA√á√ïES DA AN√ÅLISE\n\nA an√°lise foi limitada pela aus√™ncia da UF de destino do destinat√°rio, impossibilitando a valida√ß√£o da al√≠quota de ICMS interestadual.\n\n## DETALHES T√âCNICOS\n\nA al√≠quota interestadual de ICMS varia entre 4%, 7% e 12%, dependendo da UF de origem e destino, e do tipo de contribuinte. A correta identifica√ß√£o da al√≠quota √© fundamental para o c√°lculo do ICMS devido e para evitar autua√ß√µes fiscais. O regime monof√°sico de PIS/COFINS para autope√ßas estabelece que o imposto √© recolhido apenas na primeira etapa da cadeia produtiva (ind√∫stria/importador), resultando em al√≠quota zero para o revendedor. A correta identifica√ß√£o dos produtos sujeitos a esse regime permite a exclus√£o das receitas da base de c√°lculo do PIS/COFINS, reduzindo o imposto a pagar.\n\n---\n*An√°lise gerada pelo Analista Fiscal IA - Modelo: gemini*\n*Regime: LUCRO REAL - Sempre consulte um profissional cont√°bil para casos complexos*"
  },
  "resultado_tributarista": {
    "status": "parcial",
    "regime_tributario": "LUCRO REAL",
    "impostos_analisados": 3,
    "delta_impostos": {
      "icms": {
        "valor_pago": 208.07,
        "valor_devido": null,
        "delta": null,
        "percentual_diferenca": null,
        "observacoes": "N√£o √© poss√≠vel calcular o valor devido de ICMS sem a informa√ß√£o da UF de destino. A al√≠quota interestadual (4%, 7% ou 12%) e a al√≠quota interna de SP s√£o necess√°rias para o c√°lculo do ICMS e, se aplic√°vel, do DIFAL."
      },
      "pis_cofins": {
        "pis_pago": 25.16,
        "pis_devido": null,
        "cofins_pago": 115.95,
        "cofins_devido": null,
        "delta_total": null,
        "observacoes": "Oportunidade de verificar o enquadramento dos NCMs 32141010, 35069110 e 35061090 no regime monof√°sico de PIS/COFINS para autope√ßas. Se confirmado, o PIS/COFINS devido seria zero para o revendedor. Sem essa confirma√ß√£o, o c√°lculo do delta n√£o √© poss√≠vel."
      },
      "ipi": {
        "valor_pago": 13.71,
        "valor_devido": 13.71,
        "delta": 0.0,
        "observacoes": "Considerando que o valor do IPI pago √© igual ao valor devido, n√£o h√° delta neste imposto."
      }
    },
    "calculo_multas": {
      "multas_potenciais": [
        {
          "tipo_infracao": "ICMS - Recolhimento a menor (al√≠quota incorreta)",
          "base_calculo": null,
          "percentual_multa": 20.0,
          "valor_multa": null,
          "base_legal": "Art. 85, I, 'e', Lei 6.374/89 (SP)",
          "prazo_regularizacao": "Prazo para regulariza√ß√£o depende da notifica√ß√£o fiscal."
        },
        {
          "tipo_infracao": "PIS/COFINS - N√£o recolhimento (se aplic√°vel monofasia)",
          "base_calculo": null,
          "percentual_multa": 20.0,
          "valor_multa": null,
          "base_legal": "Art. 44, I, Lei 9.430/96",
          "prazo_regularizacao": "Prazo para regulariza√ß√£o depende da notifica√ß√£o fiscal."
        }
      ],
      "total_multas": null,
      "multa_minima": 165.86,
      "multa_maxima": null
    },
    "tabela_resumo": {
      "cabecalho": [
        "Imposto",
        "Pago",
        "Devido",
        "Delta",
        "% Diferen√ßa"
      ],
      "linhas": [
        [
          "ICMS",
          "208.07",
          "N/A",
          "N/A",
          "N/A"
        ],
        [
          "PIS",
          "25.16",
          "N/A",
          "N/A",
          "N/A"
        ],
        [
          "COFINS",
          "115.95",
          "N/A",
          "N/A",
          "N/A"
        ]
      ]
    },
    "analise_riscos": {
      "risco_autuacao": "M√©dio",
      "valor_total_exposicao": null,
      "recomendacoes_urgentes": [
        "Obter a UF de destino da NFe para c√°lculo correto do ICMS e DIFAL (se aplic√°vel).",
        "Verificar o enquadramento dos NCMs 32141010, 35069110 e 35061090 no regime monof√°sico de PIS/COFINS para autope√ßas."
      ],
      "prazos_criticos": [
        "Prazos para retifica√ß√£o da NFe e recolhimento de eventuais diferen√ßas de impostos."
      ]
    },
    "resumo_executivo": "A an√°lise tribut√°ria da NFe identificou a necessidade de obter a UF de destino para calcular corretamente o ICMS e o DIFAL (se aplic√°vel). Al√©m disso, h√° uma oportunidade de verificar o enquadramento dos NCMs 32141010, 35069110 e 35061090 no regime monof√°sico de PIS/COFINS para autope√ßas, o que pode resultar em uma redu√ß√£o significativa da carga tribut√°ria. A falta de informa√ß√µes precisas impede o c√°lculo exato do delta de impostos e das multas potenciais.",
    "detalhes_tecnicos": "O c√°lculo do ICMS devido requer a al√≠quota interestadual correta (4%, 7% ou 12%) e a al√≠quota interna de SP. O DIFAL √© calculado se o destinat√°rio for consumidor final. O c√°lculo do PIS/COFINS devido depende da confirma√ß√£o do enquadramento dos NCMs no regime monof√°sico. As multas foram calculadas com base na legisla√ß√£o tribut√°ria de SP e federal.",
    "limitacoes_calculo": "A falta da UF de destino impede o c√°lculo preciso do ICMS e DIFAL. A aus√™ncia de confirma√ß√£o sobre o regime monof√°sico impede o c√°lculo preciso do PIS/COFINS.",
    "modelo_utilizado": "gemini",
    "timestamp_calculo": "2025-10-30 14:09:06",
    "relatorio_hibrido": "# üßÆ RELAT√ìRIO TRIBUT√ÅRIO - C√ÅLCULO DE DELTA E MULTAS\n\n** Status do C√°lculo:** parcial\n**Regime Tribut√°rio:** LUCRO REAL\n**üî¢ Impostos Analisados:** 3\n**Timestamp:** 2025-10-30 14:09:06\n\n## TABELA RESUMO - DELTA DE IMPOSTOS\n\n| Imposto | Pago | Devido | Delta | % Diferen√ßa |\n|---|---|---|---|---|\n| ICMS | 208.07 | N/A | N/A | N/A |\n| PIS | 25.16 | N/A | N/A | N/A |\n| COFINS | 115.95 | N/A | N/A | N/A |\n\n## AN√ÅLISE DETALHADA DO DELTA\n\n### üè≠ IPI\n- **Valor Pago:** R$ 13.71\n- **Valor Devido:** R$ 13.71\n- **Delta:** R$ 0.00\n- **Observa√ß√µes:** Considerando que o valor do IPI pago √© igual ao valor devido, n√£o h√° delta neste imposto.\n\n## C√ÅLCULO DE MULTAS POTENCIAIS\n\n### DETALHAMENTO DAS MULTAS\n\n**1. ICMS - Recolhimento a menor (al√≠quota incorreta)**\n   - Base de C√°lculo: R$ 0.00\n   - Percentual: 20.00%\n   - Valor da Multa: R$ 0.00\n   - Base Legal: Art. 85, I, 'e', Lei 6.374/89 (SP)\n   - Prazo: Prazo para regulariza√ß√£o depende da notifica√ß√£o fiscal.\n\n**2. PIS/COFINS - N√£o recolhimento (se aplic√°vel monofasia)**\n   - Base de C√°lculo: R$ 0.00\n   - Percentual: 20.00%\n   - Valor da Multa: R$ 0.00\n   - Base Legal: Art. 44, I, Lei 9.430/96\n   - Prazo: Prazo para regulariza√ß√£o depende da notifica√ß√£o fiscal.\n\n## AN√ÅLISE DE RISCOS\n\n**üö® Risco de Autua√ß√£o:** M√©dio\n\n**Recomenda√ß√µes Urgentes:**\n- Obter a UF de destino da NFe para c√°lculo correto do ICMS e DIFAL (se aplic√°vel).\n- Verificar o enquadramento dos NCMs 32141010, 35069110 e 35061090 no regime monof√°sico de PIS/COFINS para autope√ßas.\n\n**Prazos Cr√≠ticos:**\n- Prazos para retifica√ß√£o da NFe e recolhimento de eventuais diferen√ßas de impostos.\n\n## RESUMO EXECUTIVO\n\nA an√°lise tribut√°ria da NFe identificou a necessidade de obter a UF de destino para calcular corretamente o ICMS e o DIFAL (se aplic√°vel). Al√©m disso, h√° uma oportunidade de verificar o enquadramento dos NCMs 32141010, 35069110 e 35061090 no regime monof√°sico de PIS/COFINS para autope√ßas, o que pode resultar em uma redu√ß√£o significativa da carga tribut√°ria. A falta de informa√ß√µes precisas impede o c√°lculo exato do delta de impostos e das multas potenciais.\n\n## DETALHES T√âCNICOS\n\nO c√°lculo do ICMS devido requer a al√≠quota interestadual correta (4%, 7% ou 12%) e a al√≠quota interna de SP. O DIFAL √© calculado se o destinat√°rio for consumidor final. O c√°lculo do PIS/COFINS devido depende da confirma√ß√£o do enquadramento dos NCMs no regime monof√°sico. As multas foram calculadas com base na legisla√ß√£o tribut√°ria de SP e federal.\n\n## LIMITA√á√ïES DO C√ÅLCULO\n\nA falta da UF de destino impede o c√°lculo preciso do ICMS e DIFAL. A aus√™ncia de confirma√ß√£o sobre o regime monof√°sico impede o c√°lculo preciso do PIS/COFINS.\n\n---\n*C√°lculo gerado pelo Tributarista Fiscal IA - Modelo: gemini*\n*Regime: LUCRO REAL - Sempre valide os c√°lculos com um profissional cont√°bil*"
  },
  "resumo_execucao": {
    "agentes_executados": 3,
    "validador_status": "parcial",
    "analista_status": "parcial",
    "tributarista_status": "parcial",
    "total_oportunidades": 3,
    "total_discrepancias": 1,
    "total_solucoes": 0,
    "produtos_analisados": 5,
    "execucao_completa": false
  },
  "timestamp_processamento": "2025-10-30T14:09:06.585865"
}